{
  "$schema": "https://json-schema.org/draft/2020-12/schema",
  "$id": "https://github.com/settanun-prime/prime-studio-mods/prime-workflow/prime.config.schema.json",
  "title": "Prime config (Prime Workflow)",
  "type": "object",
  "required": [
    "version",
    "budgets",
    "planValidation",
    "reviewGate",
    "merge",
    "isolation",
    "mcpRouting",
    "queue",
    "ledger"
  ],
  "properties": {
    "$schema": {
      "type": "string"
    },
    "version": {
      "type": "string",
      "pattern": "^\\d+\\.\\d+\\.\\d+$"
    },
    "budgets": {
      "type": "object",
      "required": [
        "maxParallelAgents",
        "maxParallelWorktrees",
        "perRole",
        "stopConditions"
      ],
      "properties": {
        "maxParallelAgents": {
          "type": "integer",
          "minimum": 1,
          "maximum": 20
        },
        "maxParallelWorktrees": {
          "type": "integer",
          "minimum": 1,
          "maximum": 50
        },
        "perRole": {
          "type": "object",
          "additionalProperties": {
            "type": "object",
            "required": [
              "maxTurns"
            ],
            "properties": {
              "maxTurns": {
                "type": "integer",
                "minimum": 1,
                "maximum": 500
              }
            }
          }
        },
        "softTokenHintPerAgent": {
          "type": "integer",
          "minimum": 1000
        },
        "hardStopOnRepeatedFailures": {
          "type": "integer",
          "minimum": 1
        },
        "stopConditions": {
          "type": "array",
          "items": {
            "type": "string"
          },
          "minItems": 1
        }
      }
    },
    "planValidation": {
      "type": "object",
      "required": [
        "required",
        "checkpointBeforeFanOut",
        "allowReplan"
      ],
      "properties": {
        "required": {
          "type": "boolean"
        },
        "checkpointBeforeFanOut": {
          "type": "boolean"
        },
        "allowReplan": {
          "type": "boolean"
        },
        "minAcceptanceChecks": {
          "type": "integer",
          "minimum": 0
        },
        "planFile": {
          "type": "string"
        }
      }
    },
    "reviewGate": {
      "type": "object",
      "required": [
        "requiredBeforeMerge",
        "requireReviewerApproval",
        "checks"
      ],
      "properties": {
        "requiredBeforeMerge": {
          "type": "boolean"
        },
        "requireReviewerApproval": {
          "type": "boolean"
        },
        "checks": {
          "type": "array",
          "items": {
            "enum": [
              "lint",
              "typecheck",
              "test"
            ]
          },
          "minItems": 1
        },
        "rerunAfterConflictResolution": {
          "type": "boolean"
        },
        "reReviewWhenPatchChanges": {
          "type": "boolean"
        },
        "stepTimeoutSec": {
          "type": "integer",
          "minimum": 10,
          "maximum": 86400
        }
      }
    },
    "merge": {
      "type": "object",
      "required": [
        "baseCandidates",
        "dryRunDefault",
        "neverForcePush"
      ],
      "properties": {
        "rebaseOnBaseBeforeMerge": {
          "type": "boolean"
        },
        "baseCandidates": {
          "type": "array",
          "items": {
            "type": "string"
          },
          "minItems": 1
        },
        "dryRunDefault": {
          "const": true
        },
        "conflictOwner": {
          "type": "string"
        },
        "neverForcePush": {
          "const": true
        },
        "pushBase": {
          "const": false
        },
        "draftPr": {
          "type": "boolean"
        },
        "deleteBranchRequiresFlag": {
          "const": true
        }
      }
    },
    "isolation": {
      "type": "object",
      "required": [
        "portBase",
        "portRange",
        "envWorktreeFile"
      ],
      "properties": {
        "uniqueDevPort": {
          "type": "boolean"
        },
        "portBase": {
          "type": "integer",
          "minimum": 1024,
          "maximum": 64000
        },
        "portRange": {
          "type": "integer",
          "minimum": 10,
          "maximum": 1000
        },
        "envWorktreeFile": {
          "type": "string"
        },
        "dbBranchPerWorktree": {
          "type": "boolean"
        },
        "dbBranchPrefix": {
          "type": "string"
        },
        "migrationOrdering": {
          "type": "string"
        },
        "forbidSharedWritableDb": {
          "type": "boolean"
        }
      }
    },
    "mcpRouting": {
      "type": "object",
      "additionalProperties": {
        "type": "object",
        "required": [
          "roles",
          "useFor",
          "optional",
          "fallback"
        ],
        "properties": {
          "roles": {
            "type": "array",
            "items": {
              "type": "string"
            },
            "minItems": 1
          },
          "useFor": {
            "type": "array",
            "items": {
              "type": "string"
            }
          },
          "optional": {
            "type": "boolean"
          },
          "auth": {
            "enum": [
              "oauth",
              "apiKey",
              "none"
            ]
          },
          "fallback": {
            "type": "array",
            "items": {
              "type": "string"
            },
            "minItems": 1
          }
        }
      }
    },
    "queue": {
      "type": "object",
      "required": [
        "order"
      ],
      "properties": {
        "order": {
          "type": "array",
          "minItems": 1,
          "items": {
            "enum": [
              "dependsOn",
              "ready",
              "baseConflicts",
              "pairConflicts",
              "overlaps",
              "diffLines"
            ]
          }
        },
        "predictConflicts": {
          "type": "boolean"
        }
      }
    },
    "ledger": {
      "type": "object",
      "required": [
        "enabled"
      ],
      "properties": {
        "enabled": {
          "type": "boolean"
        },
        "file": {
          "type": "string",
          "pattern": "^[A-Za-z0-9._-]+$"
        },
        "recordAgentRuns": {
          "type": "boolean"
        }
      }
    },
    "automation": {
      "type": "object",
      "description": "How far prime-run.mjs goes without asking. planApproval: reviewer = prime-reviewer approves the plan, user = wait for you. merge: local = merge into the local base when approved, ask = wait for you.",
      "properties": {
        "planApproval": {
          "enum": [
            "reviewer",
            "user"
          ]
        },
        "merge": {
          "enum": [
            "local",
            "ask"
          ]
        }
      }
    },
    "codex": {
      "type": "object",
      "description": "Real Codex CLI used by prime-codex.sh (PRIME_CODEX_MODEL / PRIME_CODEX_EFFORT override).",
      "properties": {
        "model": {
          "type": "string",
          "minLength": 1
        },
        "reasoningEffort": {
          "enum": [
            "minimal",
            "low",
            "medium",
            "high",
            "xhigh"
          ]
        },
        "timeoutSec": {
          "type": "integer",
          "minimum": 60
        }
      }
    },
    "team": {
      "type": "object",
      "description": "herdr agent team (prime-team.sh, prime-bg.sh). Extra CLI args per teammate kind; hermesProfile is the Hermes profile that holds Prime's own memory.",
      "properties": {
        "claudeArgs": { "type": "array", "items": { "type": "string" } },
        "codexArgs": { "type": "array", "items": { "type": "string" } },
        "hermesProfile": { "type": "string", "pattern": "^[a-z0-9][a-z0-9_-]*$" },
        "hermesArgs": { "type": "array", "items": { "type": "string" } }
      }
    }
  }
}
